Alternative,Blues,Classical,Country,HipHop/Rap,Latin,R&B,Rock
Lewis Capaldi Before You Go,Blues Image Ride Captain Ride (Single/LP Version),Altamirano Lago,Lil Nas X Old Town Road (feat. Billy Ray Cyrus) [Remix],DaBaby ROCKSTAR (feat. Roddy Ricch),Gerardo Ort√≠z Otra Borrachera,Doja Cat Say So,Bad Wolves Sober
Tones and I Dance Monkey,Derek & The Dominos Layla (40th Anniversary Version),Milana Zilnik The Best is Yet to Come,Maren Morris The Bones,Roddy Ricch The Box,ROSAL√çA & Travis Scott TKN,The Weeknd Blinding Lights,Everybody Loves an Outlaw I See Red
Lewis Capaldi Someone You Loved,B.B. King The Thrill Is Gone,Vlad Tkachuk Fantasia in D Minor K. 397/385g,Morgan Wallen Chasin' You,Post Malone Circles,"Anuel AA, Daddy Yankee & KAROL G China (feat. J Balvin & Ozuna)",Doja Cat Like That (feat. Gucci Mane),Eagles Hotel California
Billie Eilish bad guy,Dorothy Moore Misty Blue,"Paul Lewis Bagatelle in A Minor, WoO 59  ªF√ºr Elise º",Gabby Barrett I Hope,Powfu Death Bed (feat. beabadoobee),Banda Los Recoditos Elegiste un Error,Khalid Talk,Guns N' Roses Sweet Child O' Mine
Halsey You should be sad,Ronnie Earl & The Broadcasters Drown In My Own Tears,Brian Crain Sunrise,Sam Hunt Hard to Forget,StaySolidRocky Party Girl,"Bad Bunny, Jowell & Randy & √ëengo Flow Safaera",PARTYNEXTDOOR BELIEVE IT,Bon Jovi Livin' On a Prayer
Panic! At the Disco High Hopes,Etta James At Last,Hideyuki Hashimoto Es,Luke Bryan One Margarita,Post Malone & Swae Lee Sunflower (Spider-Man: Into the Spider-Verse),Banda Sinaloense MS de Sergio Liz√°rraga & Snoop Dogg Qu√© Maldici√≥n,Chris Brown No Guidance (feat. Drake),AC/DC Back In Black
Portugal. The Man Feel It Still,Walter Trout Do You Still See Me At All (feat. Jon Trout),Brian Crain Imagining,Morgan Wallen More than My Hometown,Roddy Ricch High Fashion (feat. Mustard),Los Dos Carnales El Envidioso,John Legend All of Me,Toto Africa
Halsey Without Me,Etta James I'd Rather Go Blind,Ed Sheeran & Andrea Bocelli Perfect Symphony,Morgan Wallen Whiskey Glasses,Lil Baby & 42 Dugg We Paid,The Black Eyed Peas & J Balvin RITMO (Bad Boys for Life),Usher Yeah! (feat. Lil Jon & Ludacris),Guns N' Roses Welcome to the Jungle
Imagine Dragons Thunder,Ronnie Earl & The Broadcasters For Abby,Gary Girouard The Thinker,Carly Pearce & Lee Brice I Hope You‚Äôre Happy Now,Jack Harlow Whats Poppin,"Justin Quiles, Daddy Yankee & El Alfa PAM",Surfaces Sunday Best,Queen Bohemian Rhapsody
Imagine Dragons Believer,House of Sun The House of the Rising Sun,Stephan Moccio Le Temps Qui Passe,„ÉÜ„Ç§„É©„Éº„Éª„Çπ„Ç¶„Ç£„Éï„Éà I Knew You Were Trouble.,Drake Toosie Slide,Banda Carnaval Sue√±a,Chris Brown & Young Thug Go Crazy,Journey Don't Stop Believin'
twenty one pilots Stressed Out,B.B. King & Eric Clapton Riding With the King,Chad Lawson I Wandered Lonely as a Cloud,"Dan + Shay & Justin Bieber 10,000 Hours",Drake One Dance (feat. Wizkid & Kyla),KAROL G & Nicki Minaj Tusa,Summer Walker & Bryson Tiller Playing Games (Extended Version),The Human League Don't You Want Me (Remastered)
BENEE Supalonely (feat. Gus Dapperton),ÂêæÂ¶ªÂÖâËâØ & The Swinging Boppers ‰ø∫„ÅÆ„Ç´„ÉÑ‰∏º,Alexis Ffrench Rivers (Solo Piano Version),Blake Shelton Nobody But You (feat. Gwen Stefani),Pop Smoke Dior,Sech Relaci√≥n,Whitney Houston I Wanna Dance With Somebody (2000 Remaster),AC/DC Thunderstruck
Lewis Capaldi Hold Me While You Wait,Howlin' Wolf Smokestack Lightnin',United States Army Field Band and Soldiers' Chorus American Salute,Diplo Heartless (feat. Morgan Wallen),Young T & Bugsey Don't Rush (feat. Headie One),"Black Eyed Peas, Ozuna & J. Rey Soul MAMACITA",Khalid & Disclosure Know Your Worth,AC/DC You Shook Me All Night Long
Imagine Dragons Bad Liar,Sebastin Michael Don't Stay Awake for Too Long,Milana Zilnik Calla,Lady Antebellum Need You Now,Lil Baby Emotionally Scarred,J Balvin Amarillo,Jhené Aiko P*$$Y Fairy (OTW),Bon Jovi You Give Love a Bad Name
Imagine Dragons Whatever It Takes,Etta James A Sunday Kind of Love,Kimberly StarKey Zinnwaldite Sonatina,"Diplo, Thomas Rhett & „É§„É≥„Ç∞„Éª„Çµ„Ç∞ Dance with Me",Post Malone Goodbyes (feat. Young Thug),Giovanny Ayala A Cu√°nto Me Qued√©,6LACK Know My Rights (feat. Lil Baby),"Asher Lev ,"
Ashe Moral of the Story,Canned Heat Goin' Up the Country,Lambert Gdansk,Miranda Lambert Bluebird,Don Toliver After Party,Bad Bunny Yo Perreo Sola,Summer Walker & Usher Come Thru,Guns N' Roses Paradise City
Billie Eilish everything i wanted,Joe Bonamassa A Conversation With Alice,George Skaroulis Colorado,Luke Combs Does To Me (feat. Eric Church),Post Malone Better Now,"Nio Garc√≠a, Anuel AA & Myke Towers La Jeepeta (feat. Brray & Juanka) [Remix]",Kem Lie To Me,AC/DC Highway to Hell
BENEE Supalonely (feat. Gus Dapperton),Bobby Bland Ain't No Love In the Heart of the City,Lambert In In,Travis Denning After a Few,Trevor Daniel Falling,Banda Fortuna El Atrabancado,The Weeknd In Your Eyes,Phil Collins In the Air Tonight
Halsey Graveyard,Beth Hart & Joe Bonamassa Joy,Ottorino Respighi & Elsa Respighi Tarantella,Diplo & Julia Michaels Heartless (feat. Morgan Wallen),"Jack Harlow WHATS POPPIN (Remix) [feat. DaBaby, Tory Lanez & Lil Wayne]","DJ Snake Taki Taki (feat. Selena Gomez, Ozuna & Cardi B)",H.E.R. Slide (feat. YG),The Police Every Breath You Take
Billie Eilish when the party's over,Dion Song For Sam Cooke (Here In America) [feat. Paul Simon],"Martin Jones Piano Sonata No. 5, Op. 82: III. Reverie",Luke Combs Beer Never Broke My Heart,JACKBOYS OUT WEST (feat. Young Thug),Anuel AA & Bad Bunny Hasta Que Dios Diga,Khalid Better,Lynyrd Skynyrd Sweet Home Alabama
Radiohead Creep,Â∞æÂ¥éÂòâÂÆ£ ÊúùÊó•Ê•º (ÊúùÊó•„ÅÆ„ÅÇ„Åü„ÇãÂÆ∂),"Philharmonic Promenade Orchestra Of London & Sir Adrian Boult Symphony No. 6 In F Major, Op. 68, ""Pastoral,"" IV. Tempest and Storm: Allegro",Old Dominion One Man Band,Kanye West Wash Us in the Blood (feat. Travis Scott),Banda Tierra Sagrada & Imperio Calavera Entre Lo Bueno y Lo Malo,Amy Winehouse Rehab,The Police Every Breath You Take
SHAED Trampoline,Gary Moore Still Got the Blues,Yiruma Room With A View,„ÉÜ„Ç§„É©„Éº„Éª„Çπ„Ç¶„Ç£„Éï„Éà We Are Never Ever Getting Back Together,Lil Mosey Blueberry Faygo,Bad Bunny MIA (feat. Drake),Doja Cat Say So (feat. Nicki Minaj),Teenage Time Killers Ode to Sean Hannity (feat. Jello Biafra)
Billie Eilish ocean eyes,The Animals The House of the Rising Sun,Ë•øÊùëÁî±Á¥ÄÊ±ü Á¨ëÈ°î„Å´‰ºö„Åà„Åü„Çâ,Dan + Shay Speechless,Lil Baby The Bigger Picture,Banda Sinaloense MS de Sergio Liz√°rraga Altamente Probable,Chloe x Halle Do It,Queen Another One Bites the Dust
Tones and I Never Seen the Rain,Taj Mahal Mary Don't You Weep,Melody Musings Poplar Fluff,Thomas Rhett Beer Can't Fix (feat. Jon Pardi),Kalvonix One Day I'll Be Fine,Luis Fonsi & Daddy Yankee Despacito,Lionel Richie All Night Long (All Night) [Single Version],Bruce Springsteen Dancing In the Dark
Foster the People Pumped Up Kicks,Blues Saraceno The River,Academy of St. Martin in the Fields & Sir Neville Marriner Simple Symphony Op. 4 (1998 Remastered Version): II. Playful Pizzicato,Kane Brown Cool Again,Mustard Ballin‚Äô (feat. Roddy Ricch),Los √Ångeles Azules Y la Hice Llorar (feat. Abel Pintos),6LACK Long Nights,The Beatles Let It Be
Melanie Martinez Play Date,Beth Hart & Joe Bonamassa I'll Take Care of You,Rosey Chan Autumn,Blake Shelton God's Country,"Tamezz, Blue Number Seven, VHS & 011 Invisible Session 01",Ozuna Caramelo,Tory Lanez The Take (feat. Chris Brown),The Killers Mr. Brightside
AJR Bang!,Etta James The Man I Love,Sting Fields of Gold (New Version),Chris Janson Done,Megan Thee Stallion Savage Remix (feat. Beyonc√©),La Adictiva Banda San Jos√© de Mesillas Escondidos,Mario Let Me Love You,Naked Eyes Always Something There to Remind Me
New Order Blue Monday,„Çä„Çä„ÅÇ„ÄÇ ÊµÆÊ∞ó„Åï„Çå„Åü„Åë„Å©„Åæ„Å†Â•Ω„Åç„Å£„Å¶Êõ≤„ÄÇ,Ludovico Einaudi Nuvole bianche,Justin Moore Why We Drink,S1mba Rover (feat. DTG),Daddy Yankee Con Calma (feat. Snow),Rotimi In My Bed (feat. Wale),Queen Don't Stop Me Now
Red Hot Chili Peppers Under the Bridge,Rick Krive Go Big Daddy,Lavinia Meijer Gnossienne No. 5,Jimmie Allen & Noah Cyrus This is Us,Drake Chicago Freestyle (feat. Giveon),Banda Carnaval Esta Vez Soy Yo,Ali Gatie It's You,Five Finger Death Punch A Little Bit Off
Coldplay A Sky Full of Stars,Á±≥ÂºüËèØÁâπ Mannish Boy,Agnes Fredenberg In the Stillness of Summer,LeAnn Rimes Can't Fight the Moonlight,Wiz Khalifa See You Again (feat. Charlie Puth),"Feid, J Balvin, Maluma, Nicky Jam, Sech & Justin Quiles PORFA (Remix)",TLC Waterfalls,Nickelback How You Remind Me
Wallows Are You Bored Yet? (feat. Clairo),Jeremy Sherman Rockabilly Man,"Solisti dell'orchestra ""Scarlatti"" Napoli & Ettore Gracis 3 Concerti Grossi (c.1740): 3. Largo",Marc Cohn Walking In Memphis,Post Malone Wow.,Jenni Rivera Enga√±√©moslo (Versi√≥n Banda),Kehlani Can I (feat. Tory Lanez),Huey Lewis & The News The Power of Love
Blue Jeans Adult Hits,Shishir Bhanot Kho Gaye Hum Kahan (Love Reprise),Andrea Bocelli & C√©line Dion The prayer (Duet with Celine Dion),Luke Combs Lovin' on You,Travis Scott HIGHEST IN THE ROOM,DJ Snake & J Balvin Loco Contigo (feat. Tyga),Mary J. Blige Family Affair,Bring Me The Horizon Parasite Eve
lovelytheband loneliness for love,Etta James All I Could Do Was Cry,Áü≥ÂéüÁúûÊ≤ª ÁÆ°Âº¶Ê•ΩÁµÑÊõ≤Á¨¨‰∏ÄÁï™ „ÉèÈï∑Ë™ø BWV1066 Á¨¨ÂõõÊ•ΩÁ´† „Éï„Ç©„Éº„É¨„Éº„É≥,Jason Aldean Got What I Got,Lil Baby Sum 2 Prove,Fuerza Regida El Muchacho Alegre,The Weeknd Starboy (feat. Daft Punk),Bruce Springsteen Born in the U.S.A.
Billie Eilish bury a friend,Nick Cohen Big Time (feat. Noel McKoy),Florian Christl Melodie (Solo Piano Version),Shania Twain That Don't Impress Me Much (Dance Mix),The Black Eyed Peas Where Is the Love?,Ir-Sais Dream Girl,Lauryn Hill Doo Wop (That Thing),The Pretty Reckless Death by Rock and Roll
lovelytheband Broken,The Teskey Brothers Hold Me,"„Ç∏„É£„É≥=„Éî„Ç®„Éº„É´„Éª„É©„É≥„Éë„É´, Andr√© Cazalet, Jean Michael Vinit, Regis Pasquier, Bruno Pasquier & Roland Pidoux Divertimento In D Major for Flute, Violin, Viola, Cello and 2 Horns, K. 334 (320b): I. Allegro",Blanco Brown The Git Up,6ix9ine GOOBA,Justin Sierre√±o MX y Su Banda Y No Voy a Llorar,The Weeknd Heartless,No Doubt Don't Speak
Tame Impala The Less I Know the Better,Joel Clempson True Destiny,Stephan Moccio Nuit Blanche,Luke Combs She Got the Best of Me,Future Life Is Good (feat. Drake),Bad Bunny Vete,Amy Winehouse Back to Black,Van Morrison Brown Eyed Girl
Halsey Bad At Love,B.B. King How Blue Can You Get?,"Maria Jo√£o Pires 6 Moments musicaux, Op. 94 D. 780: No. 3 in F Minor (Allegro moderato)",Luke Combs Even Though I'm Leaving,Post Malone Better Now,Grupo Firme & Luis Alfonso Partida El Yaki Cada Vez Te Extra√±o M√°s (feat. Luis Alfonso Partida El Yaki),Sade Smooth Operator (Single Version),Corey Hart Sunglasses at Night
Curtis Waters Stunnin' (feat. Harm Franklin),Johnny Heartsman The Butler Did It,"Kotaro Fukuma 3 romances sans paroles, Op. 17: No. 3, Andante moderato",Shania Twain Man! I Feel Like a Woman!,Pop Smoke For the Night (feat. Lil Baby & DaBaby),Myke Towers Diosa,Chris Brown Heat (feat. Gunna),Creedence Clearwater Revival Have You Ever Seen the Rain
Pearl Jam Jeremy,Beth Hart & Joe Bonamassa I'd Rather Go Blind,"Orchestra of the Vienna Volksoper & Franz Bauer-Theussl Horn Concerto No.3 in E-Flat Major, K.447: III. Rondo (Allegro vivace)",Dan + Shay Tequila,Quality Hot 97,"Nio Garc√≠a, Casper M√°gico & Bad Bunny Te Bot√© (feat. Darell, Ozuna & Nicky Jam) [Remix]",Trey Songz Na Na,Whitesnake Is This Love (2003 Remaster)
Smashing Pumpkins 1979,John Lee Hooker You Shook Me (feat. B.B. King),Laurence Ipsum Sunday Rain,Chris Stapleton Tennessee Whiskey,"THE SCOTTS, Travis Scott & Kid Cudi THE SCOTTS",Cuarto De Milla Muy Bonita Y Todo,The Weeknd The Hills,The Beatles Here Comes the Sun
Billie Eilish idontwannabeyouanymore,Chuck Berry Johnny B. Goode,Graf Mourja & Natalia Gous Banjo et Violon,Austin Cunningham The Girls on Fox News,„Ç®„Éü„Éç„É† The Monster (feat. Rihanna),Ir-Sais & Rauw Alejandro Dream Girl (Remix),J. Cole Work Out,Jack Scott Burning Bridges
Pearl Jam Even Flow,B.B. King Lucille,Andrea Bocelli & Matteo Bocelli Fall on Me,Brad Paisley No I in Beer,"Cardi B, Bad Bunny & J Balvin I Like It",La Arrolladora Banda el Lim√≥n de Ren√© Camacho Ahora Que Me Acuerdo,Marvin Gaye Sexual Healing,Queen Under Pressure (feat. David Bowie)
Lewis Capaldi Bruises,Polo G Mirro,"Signum Quartett Lachen und Weinen, Op. 59 No. 4, D. 777 (Arr. X. van Dijk for String Quartet)",Luke Combs Beautiful Crazy,J.I the Prince of N.Y Need Me,Bad Bunny & Tainy Callaita,6LACK Float,Cutting Crew (I Just) Died in Your Arms Tonight
The Killers Mr. Brightside (Jacques Lu Cont's Thin White Duke Mix),B.B. King Paying the Cost To Be the Boss (feat. The Rolling Stones),Evgeny Samoyloff Une larme,HARDY One Beer (feat. Lauren Alaina & Devin Dawson),Travis Scott SICKO MODE,Raymix & Paulina Rubio T√∫ Y Yo,Cheryl Lynn Got to Be Real (Single Version),4 Non Blondes What's Up?
,Etta James I Just Want to Make Love to You,Jonas Hamm Puro Como Agua,„ÉÜ„Ç§„É©„Éº„Éª„Çπ„Ç¶„Ç£„Éï„Éà 22,6ix9ine & Nicki Minaj TROLLZ,Natanael Cano Amor Tumbado,Daniel Caesar Best Part (feat. H.E.R.),Van Halen Jump
Billie Eilish i love you,Dynamic Hepnotics Soul Kind of Feeling,"Arthur Rubinstein Nocturnes, Op. 9: No. 1 in B-Flat Minor",Jake Owen Homemade,OutKast Ms. Jackson,Grupo Firme El Roto (En Vivo),Chris Brown No Guidance (feat. Drake),Bryan Adams Summer Of '69
Weezer Hero,Ronnie Bell I'll Pay the Shipping Cost,Aaron Copland & London Symphony Orchestra Fanfare for the Common Man,Shania Twain You're Still the One,Megan Thee Stallion Girls in the Hood,Bad Bunny La Dif√≠cil,The Weeknd Call Out My Name,AC/DC Hells Bells
twenty one pilots Level of Concern,Dion Blues Comin' On (feat. Joe Bonamassa),Viktor Valkov Miniatures: No. 4. Pastoral,Johnny Cash Hurt,B.o.B Nothin' On You (feat. Bruno Mars),Calibre 50 Chalito,Puff Daddy & Faith Evans I'll Be Missing You (feat. 112),Pink Floyd Wish You Were Here
Billie Eilish you should see me in a crown,Mel Waiters Got My Whiskey,Nights Amore Eternal Desolation,Kim Carnes Bette Davis Eyes,Polo G Flex (feat. Juice WRLD),Black Eyed Peas & „Éû„É´„Éº„Éû FEEL THE BEAT,Jhené Aiko B.S. (feat. H.E.R.),Survivor Eye of the Tiger
Dominic Fike 3 Nights,Blues Sisters I'd Rather Go Blind (feat. Clydie Watts),Cooper Sams Inner Introspection,Kelsea Ballerini Track Four,Andrez Babii Tricky,Pesado Me Sigue Calando,"Lionel Richie Say You, Say Me",Evanescence Bring Me To Life
Pearl Jam Alive (2004 Remix),Elmore James Dust My Broom,"Anna Lucia Richter, Esther Dierkes, NDR Chor, WDR Rundfunkchor K√∂ln, NDR Radiophilharmonie & Andrew Manze Symphony No. 2 in B-Flat Major, Op. 52, MWV A18 ""Lobgesang"": V. Ich harrete des Herrn",LOCASH One Big Country Song,Beyonc√© BLACK PARADE,J Balvin Rojo,Khalid Young Dumb & Broke,Queen We Will Rock You
WILLOW Wait a Minute!,B.B. King Blues Boys Tune,Ji≈ô√≠ Hor√°k Hint of Perfection,Sam Hunt Body Like a Back Road,Pop Smoke Aim for the Moon (feat. Quavo),T3r Elemento En Boca de Todos,Luther Vandross Never Too Much,Men At Work Down Under
Joji Gimme Love,Koren Grace Ego,"„Ç≥„É≥„Çπ„Çø„É≥„ÉÅ„É≥„Éª„É™„Éï„Ç∑„ÉÉ„ÉÑ & Ê®´Êú¨Â§ßÈÄ≤ Violin Sonata No. 8 in G Major, Op. 30 No. 3: II. Tempo di minuetto, ma molto moderato e grazioso",Shania Twain You're Still the One (International Mix),Pop Smoke The Woo (feat. 50 Cent & Roddy Ricch),Don Omar & Lucenzo Danza Kuduro (feat. Lucenzo),Childish Gambino Redbone,Toploader Dancing In the Moonlight
Daniel Powter Bad Day,Smoking Stones You Can't Always Get What You Want,Chad Lawson Stay,Charlie Rich The Most Beautiful Girl,Young Thug The London (feat. J. Cole & Travis Scott),Dos Latidos Âçó‰∫¨Ë±ÜÂ£≤„Çä,Brandy Baby Mama (feat. Chance the Rapper),Def Leppard Photograph (Live)
Lorde Royals,Etta James Stormy Weather (Keeps Rainin' All the Time),"„Ç§„É≥„Ç∞„É™„ÉÉ„Ç∑„É•„Éª„Éê„É≠„ÉÉ„ÇØ„Éª„ÇΩ„É≠„Ç§„Çπ„ÉÑ, „Ç∏„Éß„É≥„Éª„Ç®„É™„Ç™„ÉÉ„Éà„Éª„Ç¨„Éº„Éá„Ç£„Éä„Éº & „Ç∏„Éß„Éº„Ç∏„Éª„Éï„É¨„Éá„É™„ÉÉ„ÇØ„Éª„Éò„É≥„Éá„É´ Suite in F Major, HWV 348, 'Water Music': VII. [Passepied]",„ÉÜ„Ç§„É©„Éº„Éª„Çπ„Ç¶„Ç£„Éï„Éà Everything Has Changed (feat. „Ç®„Éâ„Éª„Ç∑„Éº„É©„É≥),Outkast Hey Ya! (Radio Mix/Club Mix),Pedro Cap√≥ & Farruko Calma (Remix),The Weeknd I Feel It Coming (feat. Daft Punk),Bon Jovi Wanted Dead or Alive
Vance Joy Riptide,The Moody Blues Go Now,"Arthur Rubinstein Nocturnes, Op. 9: No. 2 in E-flat",Luke Combs Six Feet Apart,Flo Rida Low (feat. T-Pain),Prince Royce Carita de Inocente,Stevie Wonder I Just Called To Say I Love You,Led Zeppelin Stairway to Heaven
Scritti Politti Perfect Way,Etta James Something's Got a Hold on Me,The Library Of The Human Soul & Vienna Session Orchestra Quirky (Intimate),Brothers Osborne All Night,Lil Durk 3 Headed Goat (feat. Lil Baby & Polo G),J Balvin & Bad Bunny LA CANCI√ìN,6LACK ATL Freestyle,Daryl Hall & John Oates Kiss On My List
jxdn Angels & Demons,Fernando Jones WBLZ (Comedy Skit),"Ralph van Raat Les heures persanes, Op. 65: XIII. Les collines au coucher du soleil. Tr√®s calme",„ÉÜ„Ç§„É©„Éº„Éª„Çπ„Ç¶„Ç£„Éï„Éà Red,Drake Demons (feat. Fivio Foreign & Sosa Geek),Banda Renovacion Suele Pasar,Seal Kiss from a Rose,LINKIN PARK In the End
Pearl Jam Better Man,Mel Waiters Hole In the Wall,"Emil Gilels & Amadeus Quartet Piano Quintet In A Major, D. 667 - ""The Trout"": IV. Thema - Andantino - Variazioni I-V - Allegretto",Jon Pardi Ain't Always the Cowboy,Saweetie My Type,Bad Bunny Si Veo a Tu Mam√°,Whitney Houston I Wanna Dance with Somebody (Who Loves Me),Steve Miller Band Jet Airliner
Talking Heads Once In a Lifetime,Walter Trout Wanna Dance,Stephan Moccio Sea Change,Jordan Davis Almost Maybes,Shaun King & Self O.N.E. Bally's and Pink Labels (feat. Self O.N.E.),Ulices Chaidez Dile Luna,SZA Love Galore (feat. Travis Scott),The Fray How to Save a Life
Billie Eilish all the good girls go to hell,The Blues Brothers Soul Man,"Avi Avital & Venice Baroque Orchestra Mandolin Concerto in C Major, RV 425: I. Allegro",Ashley McBryde One Night Standards,el maath La Hora Del t√© (feat. Andr√©s Laforet),"Rvssian, Anuel AA & Juice WRLD No Me Ame",Des'ree Life,Bruce Springsteen I'm on Fire
Capital Cities Safe and Sound,Little Walter Sad Hours,"Christophe Sirodeau 4 Klavierst√ºcke, Op. 119: I. Intermezzo in B Minor (Adagio)",Lady Antebellum Need You Now,Pop Smoke Make It Rain (feat. Rowdy Rebel),"Shakira Whenever, Wherever",Khalid Location,"Pink Floyd Another Brick In the Wall, Pt. 2"
Coldplay Adventure of a Lifetime,Canned Heat On the Road Again,"Ensemble Orchestral de Paris & John Nelson Symphonie No. 41 Jupiter en Ut Majeur, K. 551: I. Allegro Vivace","The Twang Another Brick In the Wall, Part 2",Travis Scott goosebumps,Edici√≥n Especial Si Es Posible,Snoh Aalegra I Want You Around,The Calling Wherever You Will Go
X Ambassadors HOLD YOU DOWN,B.B. King Woke Up This Morning,The Piano Guys A Thousand Years,Dierks Bentley Living,Drake God's Plan,J Balvin & Willy William Mi Gente (feat. Beyonc√©),Aya Nakamura Djadja,Boston More Than a Feeling
The Neighbourhood Sweater Weather,John Lee Hooker Boom Boom,Orchestre de l'Association des Concerts Lamoureux Les Pantins Dansent,Matt Stell Prayed for You,NF Let You Down,Adal Loreto Enterate,Chris Brown Heat (feat. Gunna),Linkin Park & Jay-Z Numb / Encore
Nirvana Smells Like Teen Spirit,Gurujibhakt Chale Chalo,Julia Gjertsen Okno,Dolly Parton Jolene,Pop Smoke 44 BullDog,Juanfran Como Llora,Estelle American Boy (feat. Kanye West),Joan Jett & The Blackhearts I Love Rock 'N Roll
twenty one pilots Ride,Gary B.B. Coleman The Sky Is Crying,"Alice Sara Ott, Bavarian Radio Symphony Orchestra & Esa-Pekka Salonen Piano Concerto in A Minor, Op. 16: II. Adagio (Live)",Maddie & Tae Die From A Broken Heart,Arizona Zervas ROXANNE,Pitbull Timber (feat. Ke$ha),Ne-Yo & Jeremih U 2 Luv,The Beatles Here Comes the Sun (2019 Mix)
Lord Huron The Night We Met,B.B. King Rock Me Baby (feat. Eric Clapton),Frederik Sn√¶land Frigjort,Morgan Wallen Cover Me Up,NLE Choppa Walk Em Down (feat. Roddy Ricch),Carin Leon Tu Amor Barato,"John Legend U Move, I Move (feat. Jhené Aiko)",Def Leppard Pour Some Sugar On Me
WALK THE MOON Shut Up and Dance,Robert Johnson Cross Road Blues,"Barbara Bonney, Orchestra of the Age of Enlightenment & Gustav Leonhardt Schweigt stille, plaudert nicht, BWV 211 ""Coffee Cantata"": IV. Ei! wie smeckt Coffee s√º√üe (Arie)",Brett Young Catch,Juice WRLD Lucid Dreams,Anuel AA Narcos,Lonr. Make the Most (feat. H.E.R.),Metallica Enter Sandman
Billie Eilish No Time To Die,The Teskey Brothers So Caught Up,Maxence Cyrin The Frenchman (Piano Solo),Gabby Barrett I Hope (feat. Charlie Puth),Drake Best I Ever Had,Pancho Barraza ¬øPor Qu√©?,Aya Nakamura Djadja (feat. Maluma) [Remix],Tom Petty Free Fallin'
Lorde Team,K I S S A M I S E D Amanda (Filha do Sol),"Daniel Barenboim Romance Sans Paroles, Op. 67, No. 4 ""La Fileuse""",Chris Lane I Don't Know About You,Pop Smoke Gangstas,J Balvin Azul,Jennifer Lopez Love Don't Cost a Thing,Manfred Mann's Earth Band Blinded By the Light
Dominic Fike Chicken Tenders,Johnnie Taylor Soul Heaven,Silas Bassa Wonder,„ÉÜ„Ç§„É©„Éº„Éª„Çπ„Ç¶„Ç£„Éï„Éà All Too Well,Wale On Chill (feat. Jeremih),Jay S√°nchez Por Tenerte,6LACK Elephant in the Room,ZZ Top Sharp Dressed Man
Green Day Oh Yeah!,Stein Urheim Paper Cutouts,New Zealand Symphony Orchestra & Andrew Schenck Adagio for Strings,High South Everybody's Getting High on Something,The Kid LAROI & Juice WRLD GO,Bad Bunny & Daddy Yankee La Santa,G.RINA All Around The World feat. ____,Metallica Nothing Else Matters
Alice In Chains Rooster,@highway Heavy Let Me Take Care of You (feat. Adrian Bagher & Coldrank),"Ludovico Einaudi, Daniel Hope & I Virtuosi Italiani Experience",Shania Twain Man! I Feel Like a Woman! (International Mix),Hit Master Your Dj Has Only Just Begin,Feid & Justin Quiles Porfa,Summer Walker & Drake Girls Need Love (Remix),Powerplay Powerplay
Saint Motel My Type,Dead Man's Uke Way Down in the Hole,"David Wilson-Johnson, Barbara Bonney, Orchestra of the Age of Enlightenment & Gustav Leonhardt Schweigt stille, plaudert nicht, BWV 211 ""Coffee Cantata"": VII. Nun folge, was dein Vater spricht (Rezitativ)",Uncle Kracker Follow Me,Arizona Zervas ROXANNE,Juanes La Camisa Negra (Sonidero Nacional Remix),J. Cole Can't Get Enough (feat. Trey Songz),Fleetwood Mac Dreams
Arctic Monkeys Do I Wanna Know?,Adrian Bagher If You Want to Leave,"Yo-Yo Ma Cello Suite No. 1 In G Major, BWV 1007: Pr√©lude",Chase Rice Lonely If You Are,Pop Smoke Bad Bitch from Tokyo (Intro),J Balvin & Willy William Mi Gente,Doja Cat & Tyga Juicy,Nickelback Rockstar
Fitz and The Tantrums I Just Wanna Shine,Somnath Mali Ruk Ja O Dil Deewane,"Frozen Silence Into the Unknown (From ""Frozen 2"")",Johnny Cash Ring of Fire,Meek Mill Going Bad (feat. Drake),Black Eyed Peas & El Alfa NO MA√ëANA,Kehlani Toxic,Kid Rock All Summer Long
Coldplay Yellow,Tiny Flaws The Ones in Your Head,Madeleine Cocolas In Distance,Lee Brice One of Them Girls,Gunna DOLLAZ ON MY HEAD (feat. Young Thug),Los Huracanes del Norte Ya Dile La Verdad,The Weeknd After Hours,Disturbed The Sound of Silence
Halsey Now Or Never,Jaye Hammer Party Mood,Timo Andres Move,Billy Joe Royal Down In the Boondocks,21 Savage a lot,Bad Bunny & Sech Ignorantes,Miguel Sky Walker (feat. Travis Scott),Crowded House Don't Dream It's Over
Coldplay Viva La Vida,Skeye Hold the Moon,London Philharmonic Orchestra & David Parry Adagio for Strings,Ingrid Andress We're Not Friends,Pop Smoke Yea Yea,Junior H Atrapado en un Sue√±o,Toni Braxton Do It,"Peter Frampton Baby, I Love Your Way (Live)"
Imagine Dragons Believer (Kaskade Remix),The Teskey Brothers Rain,The Vienna String Quartet Summertime,Parker McCollum Pretty Heart,Eminem Love the Way You Lie (feat. Rihanna),J Balvin Morado,Ben E. King Stand By Me,Billy Joel Piano Man
BANNERS Someone To You,Rod Stewart So Much to Say,Dirk Maassen Fjara (Solo Piano Version),Luke Combs Better Together,Lil Baby & 42 Dugg Grace,Calibre 50 S√≥lo t√∫,Lauryn Hill Can't Take My Eyes Off of You,Paul McCartney & Wings Silly Love Songs (Live)
"Panic! At the Disco Hey Look Ma, I Made It",King Floyd Groove Me,"Michael Hal√°sz, Michelle Breedt & Nicolaus Esterh√°zy Sinfonia Marriage of Figaro: Voi che sapete","Cory Marks Outlaws & Outsiders (feat. Travis Tritt, Ivan Moody & Mick Mars)",R.A. the Rugged Man Definition of a Rap Flow (Albee 3000) [feat. Amalie Bruun],Bad Bunny & Jhay Cortez C√ìMO SE SIENTE (Remix),Mahalia What You Did (feat. Ella Mai),Trippie Redd Dreamer
Billie Eilish bellyache,Manx Marriner Mainline Hell Bound For Heaven,Douglas Riva Enfants d'un R√™ve,Luke Combs When It Rains It Pours,Lil Baby Woah,Joan Sebastian Hoy Tengo Miedo,Joji SLOW DANCING IN THE DARK,Electric Light Orchestra Mr. Blue Sky
